{
  "$schema": "http://json-schema.org/draft-04/schema#",
  "type": "object",
  "properties": {
    "id": {
      "type": "string"
    },
    "eventId": {
      "type": "string"
    },
    "raceId": {
      "type": "string"
    },
    "ticketId": {
      "type": "string"
    },
    "eventTitle": {
      "type": "string"
    },
    "raceTitle": {
      "type": "string"
    },
    "ticketTitle": {
      "type": "string"
    },
    "createdAt": {
      "type": "string"
    },
    "updatedAt": {
      "type": "string"
    },
    "fields": {
      "type": "array",
      "items": [
        {
          "type": "object",
          "properties": {
            "id": {
              "type": "string"
            },
            "name": {
              "type": "string"
            },
            "value": {
              "type": "string"
            }
          },
          "required": ["id", "name", "value"]
        },
        {
          "type": "object",
          "properties": {
            "id": {
              "type": "string"
            },
            "name": {
              "type": "string"
            },
            "value": {
              "type": "string"
            }
          },
          "required": ["id", "name", "value"]
        },
        {
          "type": "object",
          "properties": {
            "id": {
              "type": "string"
            },
            "name": {
              "type": "string"
            },
            "value": {
              "type": "string"
            }
          },
          "required": ["id", "name", "value"]
        },
        {
          "type": "object",
          "properties": {
            "id": {
              "type": "string"
            },
            "name": {
              "type": "string"
            },
            "value": {
              "type": "string"
            }
          },
          "required": ["id", "name", "value"]
        },
        {
          "type": "object",
          "properties": {
            "id": {
              "type": "string"
            },
            "name": {
              "type": "string"
            },
            "value": {
              "type": "string"
            }
          },
          "required": ["id", "name", "value"]
        },
        {
          "type": "object",
          "properties": {
            "id": {
              "type": "string"
            },
            "name": {
              "type": "string"
            },
            "value": {
              "type": "string"
            }
          },
          "required": ["id", "name", "value"]
        },
        {
          "type": "object",
          "properties": {
            "id": {
              "type": "string"
            },
            "name": {
              "type": "string"
            },
            "value": {
              "type": "string"
            }
          },
          "required": ["id", "name", "value"]
        },
        {
          "type": "object",
          "properties": {
            "id": {
              "type": "string"
            },
            "name": {
              "type": "string"
            },
            "value": {
              "type": "string"
            }
          },
          "required": ["id", "name", "value"]
        },
        {
          "type": "object",
          "properties": {
            "id": {
              "type": "string"
            },
            "name": {
              "type": "string"
            },
            "value": {
              "type": "string"
            }
          },
          "required": ["id", "name", "value"]
        },
        {
          "type": "object",
          "properties": {
            "id": {
              "type": "string"
            },
            "name": {
              "type": "string"
            },
            "value": {
              "type": "string"
            }
          },
          "required": ["id", "name", "value"]
        },
        {
          "type": "object",
          "properties": {
            "id": {
              "type": "string"
            },
            "name": {
              "type": "string"
            },
            "value": {
              "type": "string"
            }
          },
          "required": ["id", "name", "value"]
        },
        {
          "type": "object",
          "properties": {
            "id": {
              "type": "string"
            },
            "name": {
              "type": "string"
            },
            "value": {
              "type": "string"
            }
          },
          "required": ["id", "name", "value"]
        },
        {
          "type": "object",
          "properties": {
            "id": {
              "type": "string"
            },
            "name": {
              "type": "string"
            },
            "value": {
              "type": "string"
            }
          },
          "required": ["id", "name", "value"]
        }
      ]
    }
  },
  "required": [
    "id",
    "eventId",
    "raceId",
    "ticketId",
    "eventTitle",
    "raceTitle",
    "ticketTitle",
    "createdAt",
    "updatedAt",
    "fields"
  ]
}
